<?xml version="1.0"?>
<?xml-stylesheet type="text/xsl" href="biglietti.xsl"?> 
<biglietti xmlns:b="http://www.imperofiere.com" xmlns:xs="http://www.w3.org/2001/XMLSchema-instance" xs:schemaLocation="http://www.imperofiere.com biglietti.xsd">

  <biglietto tipo="intero" prezzo="10">
    <qtatot>123</qtatot>
    <venduti>26</venduti>
  </biglietto>
  
  <biglietto tipo="ridotto" prezzo="5">
    <qtatot>95</qtatot>
    <venduti>11</venduti>
  </biglietto>
  
  <biglietto tipo="Spam Side VIP" prezzo="2">
    <qtatot>42</qtatot>
    <venduti>42</venduti>
  </biglietto>
</biglietti>